person_id,slug,name,aka_names,role_type,socials,bio_short,photo_ref,data_confidence,source
alex-pychtin,alex-pychtin,Alex Pychtin,,actor,,"Canadian-Australian actor. Leads include The Heiress Blacklisted Her Husband, Pregnant by the Billionaire, Daddy's Best Friend Made Me His Billionaire Wife. Work has passed 200M views. Also Amazon Prime, Showtime and Hallmark credits.",,verified,recovered_2026-07-04_build
anina-net,anina-net,Anina Net,,actor,,"International actress (US, Europe, Asia). In verticals since 2021, 50+ titles, one of the most prolific in the format. #1 ranking verticals include Makeup Sex, My Two-Faced Billionaire Husband, Pregnant with My Infertile Alpha King. Also film/TV action roles (Ultimate Mission, Fury 12 Hours, Positioning on CCTV-1).",,verified,recovered_2026-07-04_build
eric-taylor-guilmette,eric-taylor-guilmette,Eric Taylor Guilmette,,actor,,"American actor, producer and poet (Arise Artists Agency). Massachusetts-born, LA-based. 30+ vertical leads across all major platforms. Producer/creator of vampire series Love & Blood (2025). 200+ romance novel covers. Feature: Tails of Christmas (Great American Family / Amazon Prime).",,verified,recovered_2026-07-04_build
grace-swanson,grace-swanson,Grace Swanson,,actor,https://www.imdb.com/name/nm12867081/,"LA-based actor and director. Northwestern BA Theatre 2022, British American Drama Academy London. Vertical credits include True Luna, Summer Skies, I CAN'T CUT IT OUT. Commercial work for Norms Diner, Harvest Snaps, Frolic Ice Cream.",https://v-mps.crazymaplestudios.com/actorIMG/58a9ae75d68268deactor.jpg,verified,recovered_2026-07-04_build
jake-hobbs,jake-hobbs,Jake Hobbs,Jacob Douglas Hobbs,actor,,"Vertical drama actor known for Fated Deal with the Mafia King (2024), The Return of My Drama Queen (2024) and Back from Hell to Take My Bow (2025).",,verified,recovered_2026-07-04_build
kasey-esser,kasey-esser,Kasey Esser,,actor,https://www.imdb.com/name/nm6820472/,"Labeled the breakout star of the verticals industry by Rolling Stone. 35+ vertical dramas, 400M+ views. Born Feb 3 1989, Evansville, Indiana. Also produces (Love in the Shadows, Love Under Fire). Owns Essers of Los Angeles training studios. Profiled in NYT, Cosmopolitan, Rest of World, SCMP.",https://v-mps.crazymaplestudios.com/images/26fc71a0-48a8-11f1-acb2-c14bef828c82.jpg,verified,recovered_2026-07-04_build
neela-jolene,neela-jolene,Neela Jolene,,actor,https://www.imdb.com/name/nm12227636/,"Lead in 16 short dramas by end of 2025. Supporting roles in features Our Family Pride, I Fell in Love with Santa, Cotton Candy Bubble Gum. Lifetime movie credits. Two short drama leads accepted in January 2026 alone.",https://v-mps.crazymaplestudios.com/images/9bfe8b40-2cad-11f0-93de-cb0b88a6d7a9.jpg,verified,recovered_2026-07-04_build
nick-ritacco,nick-ritacco,Nick Ritacco,,actor,https://www.imdb.com/name/nm8897964/,"Chicago-born, NYU Tisch BFA, Stella Adler trained. Homeland and Law & Order: SVU before verticals. 40+ vertical micro-dramas in two years. First vertical: Billionaire CEO's Obsession (GoodShort, 2023). Top ReelShort collaborator. Based in Santa Monica.",https://v-mps.crazymaplestudios.com/actorIMG/87ef2712640b101cactor.jpg,verified,recovered_2026-07-04_build
noah-fearnley,noah-fearnley,Noah Fearnley,,actor,https://www.imdb.com/name/nm10885467/,"American actor from Orange, Connecticut. 50+ vertical films, one of the most recognizable faces in the format. Films on Apple TV, Hulu, Lifetime. Theatrical debut in Mercy (2026) with Chris Pratt; plays Michael Bergin in FX series Love Story.",https://v-mps.crazymaplestudios.com/actorIMG/87379c45932a4f83actor.jpg,verified,recovered_2026-07-04_build
teig-sadhana,teig-sadhana,Teig Sadhana,,actor,,Australian-English actor based in NYC. Stella Adler Conservatory graduate. Won Vertical Drama Love Fan Awards 2024 Rising Star. Partnered with Steadfast Productions NYC and Vertical Drama Love on a 2026 slate of custom-written vertical films. Theatre background incl. Almeida Theatre.,,verified,recovered_2026-07-04_build
evan-adams,evan-adams,Evan Adams,,actor,https://www.imdb.com/name/nm12201270/,"American actor and stuntman, one of ReelShort's most searched leading men, known for bad-boy and teen-drama heartthrob roles. Breakout roles include Zach Walker in The Senator's Son (interactive) and Summer Situationship. Screen debut in The Wrong Valentine (2021); indie horror Reed's Point (2022); stunt work since his late teens.",https://v-mps.crazymaplestudios.com/actorIMG/28ea23b786cc95f2actor.jpg,verified,zip_ingest_2026-07-14
jesse-morales,jesse-morales,Jesse Morales,,actor,https://www.imdb.com/name/nm5960414/,"ReelShort lead and platform personality: co-host of ReelTalk and mentor judge on The Next ReelStar reality competition. Leads span romance, sports drama and action.",https://v-mps.crazymaplestudios.com/actorIMG/e1772c2ef570a6c1actor.jpg,verified,reelshort_tag_scrape_2026-07-14
luke-charles-stafford,luke-charles-stafford,Luke Charles Stafford,Lukas Charles Stafford,actor,https://www.imdb.com/name/nm11276021/,"American actor, singer and songwriter from Anderson, Indiana. Broadway (Home for the Holidays), Lifetime thrillers, SAG feature East of Middle West, and Carrie Underwood's Dirty Laundry video before verticals. Broke out as Dominic Moon in Accidental Surrogate for Alpha.",https://v-mps.crazymaplestudios.com/actorIMG/9df5678040a88655actor.jpg,verified,reelshort_tag_scrape_2026-07-14
connor-tuohy,connor-tuohy,Connor Tuohy,,actor,,"ReelShort lead known for The Call Boy I Met in Paris, one of the platform's biggest romances at 168M+ views.",,verified,reelshort_tag_scrape_2026-07-14
jarred-harper,jarred-harper,Jarred Harper,,actor,,"Actor, director and model. Leads ReelShort's flagship The Double Life of My Billionaire Husband, one of the most-viewed vertical dramas ever at 522M+ views.",,verified,reelshort_tag_scrape_2026-07-14
cameron-saffle,cameron-saffle,Cameron Saffle,,actor,https://www.imdb.com/name/nm10604385/,"ReelShort lead of The CEO's Contract Wife, one of the platform's foundational 2022 hits at 116M+ views.",https://v-mps.crazymaplestudios.com/actorIMG/a75eab0fe814f192actor.jpg,verified,reelshort_tag_scrape_2026-07-14
thomas-william-king,thomas-william-king,Thomas William King,,actor,,"ReelShort lead whose Money, Guns, and a Merry Christmas passed 274M views, among the platform's biggest titles.",,verified,reelshort_tag_scrape_2026-07-14
roman-chsherbakov,roman-chsherbakov,Roman Chsherbakov,,actor,,Vertical actor who began as a background extra and climbed to supporting and lead roles. Known for the Big Bad Husband franchise and as Clint Woods in The CEO's Contract Wife. Also appeared in the 2022 feature Shark Side of the Moon. Creates social content with his wife Serine.,,verified,reelshort_tag_scrape_2026-07-14
ian-schutzman,ian-schutzman,Ian Schutzman,,actor,,ReelShort actor known for dark mafia romance leads.,,verified,reelshort_tag_scrape_2026-07-14
j-j-michaels,j-j-michaels,J.J. Michaels,,actor,https://www.imdb.com/name/nm1578609/,"ReelShort lead known for marriage-of-convenience romances Hello, Let's Get Married and Uncle William, Please Say I Do!",https://v-mps.crazymaplestudios.com/images/954c9190-1685-11f0-a38f-0d66b56fc320.jpg,verified,reelshort_tag_scrape_2026-07-14
aaron-oberst,aaron-oberst,Aaron Oberst,,actor,https://www.imdb.com/name/nm11499949/,"ReelShort lead spanning steamy romance and revenge thrillers, including Surrender to My Professor and Escorting the Ruthless Billionaire Doctor. Regular on ReelTalk's BroTalk episodes.",https://v-mps.crazymaplestudios.com/images/fa856910-3f65-11f1-acb2-c14bef828c82.jpg,verified,reelshort_tag_scrape_2026-07-14
adam-daniel,adam-daniel,Adam Daniel,,actor,https://www.imdb.com/name/nm1491262/,"Breakout ReelShort lead. His Move Aside! I'm the Final Boss passed 314M views, and he fronts revenge-drama hits like You Fired A Tech Genius and Cooking My Way Back to Love.",https://v-mps.crazymaplestudios.com/images/dc9c6970-ae20-11f0-a06b-bdb674869ea1.jpg,verified,reelshort_tag_scrape_2026-07-14
james-oblak,james-oblak,James Oblak,,actor,,"Actor with a musical theatre background (Avenue Q national credits) who crossed into verticals, leading ReelShort's My Billionaire Ever After.",,verified,reelshort_tag_scrape_2026-07-14
david-james,david-james,David James,,actor,,"ReelShort lead of Wrong Marriage, Fated Groom.",,verified,reelshort_tag_scrape_2026-07-14
samuel-o-morgan,samuel-o-morgan,Samuel O Morgan,,actor,,ReelShort lead of small-town romance The Lady Boss's Small Town Valentine.,,verified,reelshort_tag_scrape_2026-07-14
tim-stein,tim-stein,Tim Stein,,actor,https://www.imdb.com/name/nm17019356/,ReelShort lead whose Falling for My Ex's Mafia Dad passed 175M views. Regular in pregnancy and billionaire romance leads.,https://v-mps.crazymaplestudios.com/images/48db4040-2cb0-11f0-93de-cb0b88a6d7a9.jpg,verified,reelshort_tag_scrape_2026-07-14
griffin-blazi,griffin-blazi,Griffin Blazi,,actor,https://www.imdb.com/name/nm7507037/,,https://v-mps.crazymaplestudios.com/images/fd1c3890-15e3-11f0-a38f-0d66b56fc320.jpg,needs_check,scrape_2026-07-14
ben-armstrong,ben-armstrong,Ben Armstrong,,actor,https://www.imdb.com/name/nm14545306/,,https://v-mps.crazymaplestudios.com/images/ad4edfe0-138d-11f1-84ad-6b5693b490dc.jpg,needs_check,scrape_2026-07-14
tristan-rewald,tristan-rewald,Tristan Rewald,,actor,,,,needs_check,scrape_2026-07-14
andrew-fultz,andrew-fultz,Andrew Fultz,,actor,,,,needs_check,scrape_2026-07-14
harrison-harber,harrison-harber,Harrison Harber,,actor,,,,needs_check,scrape_2026-07-14
samuel-irwin-hill,samuel-irwin-hill,Samuel Irwin Hill,,actor,,,,needs_check,scrape_2026-07-14
justin-daniel-price,justin-daniel-price,Justin Daniel Price,,actor,,,,needs_check,scrape_2026-07-14
ali-badalov,ali-badalov,Ali Badalov,,actor,,,,needs_check,scrape_2026-07-14
carter-sirianni,carter-sirianni,Carter Sirianni,,actor,https://www.imdb.com/name/nm11419964/,,https://v-mps.crazymaplestudios.com/images/3a5ba4e0-193d-11f1-84ad-6b5693b490dc.jpg,needs_check,scrape_2026-07-14
adam-huss,adam-huss,Adam Huss,,actor,,,,needs_check,scrape_2026-07-14
evan-wick,evan-wick,Evan Wick,,actor,,,,needs_check,scrape_2026-07-14
jordan-roy-frank,jordan-roy-frank,Jordan Roy Frank,,actor,https://www.imdb.com/name/nm16346660/,,https://v-mps.crazymaplestudios.com/images/359fe6e0-3f63-11f1-acb2-c14bef828c82.jpg,needs_check,scrape_2026-07-14
drew-ater,drew-ater,Drew Ater,,actor,https://www.imdb.com/name/nm6900774/,,https://v-mps.crazymaplestudios.com/images/0567fac0-1684-11f0-a38f-0d66b56fc320.jpg,needs_check,scrape_2026-07-14
aidan-miguel-browne,aidan-miguel-browne,Aidan Miguel Browne,,actor,,,,needs_check,scrape_2026-07-14
nicholas-rodrigues,nicholas-rodrigues,Nicholas Rodrigues,,actor,,,,needs_check,scrape_2026-07-14
richard-sharrah,richard-sharrah,Richard Sharrah,,actor,https://www.imdb.com/name/nm5340956/,,https://v-mps.crazymaplestudios.com/actorIMG/f32c73940650e982actor.jpg,needs_check,scrape_2026-07-14
levi-peterson,levi-peterson,Levi Peterson,,actor,,,,needs_check,scrape_2026-07-14
sam-myerson,sam-myerson,Sam Myerson,,actor,https://www.imdb.com/name/nm5335850/,,https://v-mps.crazymaplestudios.com/images/c6d27090-3f5b-11f1-acb2-c14bef828c82.jpg,needs_check,scrape_2026-07-14
seth-edeen,seth-edeen,Seth Edeen,Seth Eden,actor,https://www.imdb.com/name/nm14542242/,,https://v-mps.crazymaplestudios.com/images/080db3a0-122d-11f1-84ad-6b5693b490dc.jpg,needs_check,scrape_2026-07-14
alex-trumble,alex-trumble,Alex Trumble,,actor,,,,needs_check,scrape_2026-07-14
chad-wrinkles,chad-wrinkles,Chad Wrinkles,,actor,,,,needs_check,scrape_2026-07-14
aaron-babcock,aaron-babcock,Aaron Babcock,,actor,,,,needs_check,scrape_2026-07-14
scott-cooper,scott-cooper,Scott Cooper,Scot Cooper,actor,,,,needs_check,scrape_2026-07-14
chris-quartuccio,chris-quartuccio,Chris Quartuccio,,actor,https://www.imdb.com/name/nm9404185/,,https://v-mps.crazymaplestudios.com/images/068ad670-2caa-11f0-93de-cb0b88a6d7a9.jpg,needs_check,scrape_2026-07-14
tyler-johnson-ellis,tyler-johnson-ellis,Tyler Johnson Ellis,,actor,https://www.imdb.com/name/nm11466170/,,https://v-mps.crazymaplestudios.com/images/29037ef0-25fb-11f1-84ad-6b5693b490dc.jpg,needs_check,scrape_2026-07-14
sully-christian,sully-christian,Sully Christian,,actor,,,,needs_check,scrape_2026-07-14
samantha-drews,samantha-drews,Samantha Drews,Samantha Drew,actor,https://www.imdb.com/name/nm11843540/,"Samantha Drews as Suki Ruskin Actress, writer, and producer Samantha Drews plays Cyberking Reclaims His Throne main character Suki Ruskin.",https://v-mps.crazymaplestudios.com/images/800912e0-1391-11f1-84ad-6b5693b490dc.jpg,scraped,reelshort_actress_tag
morgan-tate,morgan-tate,Morgan Tate,,actor,https://www.imdb.com/name/nm13218603/,"Meet Morgan Tate, an actress in the world of vertical dramas and short movies. Before deciding to be an actress, Morgan Tate was and is still into dancing and singing.",https://v-mps.crazymaplestudios.com/images/3199f930-43fc-11f1-acb2-c14bef828c82.jpg,scraped,reelshort_actress_tag
candace-mizga,candace-mizga,Candace Mizga,,actor,,,,scraped,reelshort_actress_tag
finley-riter,finley-riter,Finley Riter,,actor,,"Actress Finley Riter As Clarisse Morgan In Resisting Mr Lloyd, Clarisse Morgan played by Finley Riter is an actress based out of Los Angeles.",,scraped,reelshort_actress_tag
eli-jane,eli-jane,Eli Jane,,actor,https://www.imdb.com/name/nm2897828/,"The movie has her working with stars like Eli Jane, Johnny Briseño, Mason Eaglin, and Ricardo Ortiz-Barreto.",https://v-mps.crazymaplestudios.com/actorIMG/013fb806147f933factor.jpg,scraped,reelshort_actress_tag
maya-jenson,maya-jenson,Maya Jenson,,actor,https://www.imdb.com/name/nm11934562/,"Caroline Harrington, played by the talented actor Maya Jenson, is a wealthy heiress of the Harrington family.",https://v-mps.crazymaplestudios.com/actorIMG/3ffc198af2aed825actor.jpg,scraped,reelshort_actress_tag
anna-stadler,anna-stadler,Anna Stadler,Ana Stadler,actor,https://www.imdb.com/name/nm11231767/,Anna Stadler as Christy Lane Anna Stadler leads the When Love’s Sorrow Plays Again cast as the actress portraying Christy Lane. Ryan Vincent’s early established chemistry with Anna Stadler help his role to land with intensity.,https://v-mps.crazymaplestudios.com/images/185679e0-1684-11f0-a38f-0d66b56fc320.jpg,scraped,reelshort_actress_tag
julia-magdalena,julia-magdalena,Julia Magdalena,,actor,,,,scraped,reelshort_actress_tag
peyton-alicia-tucker,peyton-alicia-tucker,Peyton Alicia Tucker,Peyton Alica Tucker,actor,,,,scraped,reelshort_actress_tag
tess-dinerstein,tess-dinerstein,Tess Dinerstein,,actor,https://www.imdb.com/name/nm3771470/,"Office Girl Next up in Jared Anthony Smith movies is 2025’s TV mini-series Office Girl, which co-stars Tess Dinerstein, Aaron Oberst, and Ryan Lusignan.",https://v-mps.crazymaplestudios.com/images/8dbc6180-1685-11f0-a38f-0d66b56fc320.jpg,scraped,reelshort_actress_tag
alessia-medina,alessia-medina,Alessia Medina,,actor,https://www.imdb.com/name/nm10081820/,"Alessia Medina is an actress who has bagged deals with many organizations. Alessia Medina is an actress, a model, a singer, a costume designer, and a cosplayer from Sydney, New South Wales, Australia.",https://v-mps.crazymaplestudios.com/images/9e02f580-2ca7-11f0-93de-cb0b88a6d7a9.jpg,scraped,reelshort_actress_tag
nadia-wilemski,nadia-wilemski,Nadia Wilemski,,actor,,"Like Nadia Wilemski, Sully Christian, the actor behind Adrian’s role, has played in several villain roles before.",,scraped,reelshort_actress_tag
anna-derusso,anna-derusso,Anna DeRusso,,actor,https://www.imdb.com/name/nm12059636/,Anna DeRusso as Seraph Montclair Anna DeRusso leads Your Love Broke My Heart cast as the actress who plays Seraph Montclair.,https://v-mps.crazymaplestudios.com/images/706572f0-2ca8-11f0-93de-cb0b88a6d7a9.jpg,scraped,reelshort_actress_tag
alyriana-ivey,alyriana-ivey,Alyriana Ivey,,actor,,"Alyriana Ivey as Monica Well-known influencer, actress and photographer, Alyriana has captured the hearts of many drama addicts.",,scraped,reelshort_actress_tag
tina-mirka,tina-mirka,Tina Mirka,,actor,,"Tina Mirka as Brooks Born in Dayton, Ohio, Tina Mirka was only in high school when she moved to Los Angeles with her mother to pursue her dreams in acting.",,scraped,reelshort_actress_tag
hannah-lowery,hannah-lowery,Hannah Lowery,,actor,https://www.imdb.com/name/nm12434081/,,https://v-mps.crazymaplestudios.com/images/a74dde40-16a1-11f1-84ad-6b5693b490dc.jpg,scraped,reelshort_actress_tag
madeleine-rocha-barnette,madeleine-rocha-barnette,Madeleine Rocha-Barnette,,actor,https://www.imdb.com/name/nm17067340/,"Madeleine Rocha-Barnette as Casey Reed Next up in Backstage Romance with the Popstar cast lineup we have the talented Madeleine Rocha-Barnette, a South Dakota born actress, raised in Texas with BFA in theater performance and MFA in acting.",https://v-mps.crazymaplestudios.com/images/5070ee90-122e-11f1-84ad-6b5693b490dc.jpg,scraped,reelshort_actress_tag
abigail-stanton,abigail-stanton,Abigail Stanton,,actor,https://www.imdb.com/name/nm7841808/,"Abigail Stanton as Hera Abigal Stanton also joins The Daughter of Zeus cast as the actress who portrays Hera, the bitter, and vindictive Queen of the Olympus.",https://v-mps.crazymaplestudios.com/images/54ce12b0-2ca6-11f0-93de-cb0b88a6d7a9.jpg,scraped,reelshort_actress_tag
arielle-cartwright,arielle-cartwright,Arielle Cartwright,,actor,,"Arielle Cartwright as Natty Parker Australian born actress Arielle Cartwright, who previously featured in Falling For My Dad’s Best Friend as Kylie, plays the antagonist character Natty Parker in Slay to Fosters I Took His Uncle movie.",,scraped,reelshort_actress_tag
bri-ana-wagner,bri-ana-wagner,Bri Ana Wagner,,actor,,,,scraped,reelshort_actress_tag
sarah-jayne-rothkopf,sarah-jayne-rothkopf,Sarah Jayne Rothkopf,,actor,https://www.imdb.com/name/nm3362184/,"Sarah Jayne Rothkopf as Charlotte Sinclair Next up, meet Sarah Jayne Rothkopf, the actress who is commanding in her role with her excellent screen presence and energy.",https://v-mps.crazymaplestudios.com/images/e960afc0-1683-11f0-a38f-0d66b56fc320.jpg,scraped,reelshort_actress_tag
christine-gonzalez,christine-gonzalez,Christine Gonzalez,Christine Gonzales,actor,https://www.imdb.com/name/nm16803938/,"Christine Gonzalez’s Mini Bio Catch a glimpse of Christine Gonzalez actress mini bio. Christine Gonzalez is an actress from Ecuador, America.",https://v-mps.crazymaplestudios.com/images/0f01bd00-2caa-11f0-93de-cb0b88a6d7a9.jpg,scraped,reelshort_actress_tag
moriah-boone,moriah-boone,Moriah Boone,,actor,https://www.imdb.com/name/nm11347705/,"Jordan is played by Moriah Boone, a talented American actress, born in Arizona.",https://v-mps.crazymaplestudios.com/images/132360a0-1390-11f1-84ad-6b5693b490dc.jpg,scraped,reelshort_actress_tag
malone-thomas,malone-thomas,Malone Thomas,,actor,,"As for the behind-the-scenes actress, this is the first time Malone Thomas appears on-screen!",,scraped,reelshort_actress_tag
eloise-lola-gordon,eloise-lola-gordon,Eloise Lola Gordon,,actor,,"Eloise Lola Gordon As Kristy Troy Born and raised in Denver, Eloise is an aspiring actress, director, and writer.",,scraped,reelshort_actress_tag
violet-bennett,violet-bennett,Violet Bennett,Violet Bennet,actor,,"Violet Bennett is an actress who works with numerous brands, companies, and platforms. Conclusion Violet Bennett is a distinguished actress known for her outstanding roles in various movies.",,scraped,reelshort_actress_tag
bella-mraz,bella-mraz,Bella Mraz,,actor,https://www.imdb.com/name/nm15417823/,Zoey Whitmore (Actress: Bella Mraz) Zoey Whitmore in the Gossip Godmother full movie used to be the only struggling scholarship student before she met the Gossip Godmother.,https://v-mps.crazymaplestudios.com/images/ad95dba0-2ca9-11f0-93de-cb0b88a6d7a9.jpg,scraped,reelshort_actress_tag
tiffany-alvord,tiffany-alvord,Tiffany Alvord,,actor,https://www.imdb.com/name/nm3849933/,"Tiffany Alvord as Selene Yaris Born on 11 December, 1992, Tiffany Alvord is an American actor, singer, and songwriter from California.",https://v-mps.crazymaplestudios.com/images/40b9a5a0-2cb0-11f0-93de-cb0b88a6d7a9.jpg,scraped,reelshort_actress_tag
avery-lynch,avery-lynch,Avery Lynch,,actor,https://www.imdb.com/name/nm10451127/,The pretty face behind Natalie’s exceptional role is Avery Lynch.,https://v-mps.crazymaplestudios.com/actorIMG/2c956a5b0486dcdcactor.jpg,scraped,reelshort_actress_tag
daniela-couso,daniela-couso,Daniela Couso,,actor,https://www.imdb.com/name/nm12191133/,"Together with Richard Sharrah and Daniela Couso , she starred as the female lead’s sister named, Abby Hart.",https://v-mps.crazymaplestudios.com/actorIMG/552361ba0a65da27actor.jpg,scraped,reelshort_actress_tag
maria-barseghian,maria-barseghian,Maria Barseghian,Maria Barseghnian,actor,https://www.imdb.com/es/name/nm9981575/,"Indeed, Maria Barseghian, the actress who plays Clara’s roles, has executed the scenes brilliantly.",https://v-mps.crazymaplestudios.com/images/5adf2dc0-122d-11f1-84ad-6b5693b490dc.jpg,scraped,reelshort_actress_tag
alena-savostikova,alena-savostikova,Alena Savostikova,,actor,,,,scraped,reelshort_actress_tag
ashley-michelle-grant,ashley-michelle-grant,Ashley Michelle Grant,,actor,https://www.imdb.com/name/nm12474432/,"By the way, Ashley Michelle Grant’s roles are more than those of Serena Monroe’s Escorting the Heiress movie! Ashley Michelle Grant was born in Phoenix, Arizona, on November 19, 2005.",https://v-mps.crazymaplestudios.com/actorIMG/51b87223c90a292aactor.jpg,scraped,reelshort_actress_tag
haley-lohrli,haley-lohrli,Haley Lohrli,Hayley Lohrli,actor,,"Part 1: Who’s in Operation Christmas Trap—Meet the Exciting Cast Lineup Haley Lohrli as Winnie Cullen Haley Lohrli is a writer, actress, and producer.",,scraped,reelshort_actress_tag
rebecca-stoughton,rebecca-stoughton,Rebecca Stoughton,,actor,https://www.imdb.com/name/nm13386865/,,https://v-mps.crazymaplestudios.com/images/11fb61b0-193e-11f1-84ad-6b5693b490dc.jpg,scraped,reelshort_actress_tag
molly-anderson,molly-anderson,Molly Anderson,,actor,,The 2023 edition movie featuring Molly Anderson’s role was T he Double Life Of My Billionaire Husband .,,scraped,reelshort_actress_tag
brittney-rae,brittney-rae,Brittney Rae,,actor,,,,scraped,reelshort_actress_tag
autumn-noel,autumn-noel,Autumn Noel,,actor,https://www.imdb.com/name/nm9857783/,"Behind the scenes it’s the beautiful Autumn Noel, the actor of The Words movie, who puts on a resonating and mesmerizing performance as Lennon.",https://v-mps.crazymaplestudios.com/images/8e75dd70-3f62-11f1-acb2-c14bef828c82.jpg,scraped,reelshort_actress_tag
sarah-noelle,sarah-noelle,Sarah Noelle,,actor,https://www.imdb.com/name/nm11456033/,"In the real world, Sarah Noelle is the actress playing Samantha.",https://v-mps.crazymaplestudios.com/images/04a5d540-a99a-11f0-a06b-bdb674869ea1.jpg,scraped,reelshort_actress_tag
nicole-mattox,nicole-mattox,Nicole Mattox,,actor,https://www.imdb.com/name/nm11476913/,Here’s where she forms chemistry with the leading actor and actress: Eric Guilmette and Nicole Mattox.,https://v-mps.crazymaplestudios.com/images/5576b2c0-11f8-11f1-84ad-6b5693b490dc.jpg,scraped,reelshort_actress_tag
emma-hullar,emma-hullar,Emma Hullar,,actor,https://www.imdb.com/name/nm13846675/,"Who Is Emma Hullar, The Actress Behind Sarah Channel?",https://v-mps.crazymaplestudios.com/actorIMG/e7376d3797f8fe80actor.jpg,scraped,reelshort_actress_tag
alyona-real,alyona-real,Alyona Real,,actor,https://www.imdb.com/name/nm5900194/,,https://v-mps.crazymaplestudios.com/images/250fec20-1684-11f0-a38f-0d66b56fc320.jpg,scraped,reelshort_actress_tag
meg-bush,meg-bush,Meg Bush,,actor,,"Here, Meg Bush not only stops as the actress who plays Emma in the entire Taming My Bullies series.",,scraped,reelshort_actress_tag
christine-oswald,christine-oswald,Christine Oswald,,actor,,"Christine Oswald as Grace Brooks Christine Oswald makes a stunning appearance in Campus Saga Superpower Teen cast as the actress portraying Grace Brooks. Christine Oswald is an actress based in Atlanta, GA, and she’s been doing extremely well in her pursuit to set a lifelong career in the entertainment industry.",,scraped,reelshort_actress_tag
caitlyn-cosette-lucero,caitlyn-cosette-lucero,Caitlyn Cosette Lucero,,actor,,,,scraped,reelshort_actress_tag
juliet-chevelle,juliet-chevelle,Juliet Chevelle,,actor,https://www.imdb.com/name/nm11985919/,"Juliet Chevelle is one actress who won’t fail to leave you shocked and captivated with her performances. Juliet Chevelle is an actress, model, and writer who was born and raised in Texas.",https://v-mps.crazymaplestudios.com/images/fbd0f2d0-2cab-11f0-93de-cb0b88a6d7a9.jpg,scraped,reelshort_actress_tag
emilyrose-morris,emilyrose-morris,EmilyRose Morris,,actor,,"Born and raised in Los Angeles, EmilyRose Morris is who we call a true Hollywood beauty. Blonde-haired, green-eyed beauty EmilyRose Morris is an American actor and producer.",,scraped,reelshort_fandom_cast
ryan-jacobucci,ryan-jacobucci,Ryan Jacobucci,,actor,,"Ryan Jacobucci is a former athlete, an actor, and a model. Ryan Jacobucci is also known for his roles in short media and vertical series.",,scraped,reelshort_fandom_cast
volodymyr-pielikh,volodymyr-pielikh,Volodymyr Pielikh,,actor,,"Volodymyr Pielikh is a Ukrainian actor and model. As a model, Volodymyr Pielikh has appeared in various international runway appearances and worked alongside big names like Heidi Klum.",,scraped,reelshort_fandom_cast
bailee-miner,bailee-miner,Bailee Miner,,actor,,"Bailee Miner as Ava Talented actress Bailee Miner, known for the Underworld Guardian King and Alpha Daddy Makes Me Yours movies, plays Ava in Don’t Toy with My Heart, Mr.",,scraped,reelshort_fandom_cast
