person_id,slug,name,aka_names,role_type,socials,bio_short,photo_ref,data_confidence,source
alicia-blasingame,alicia-blasingame,Alicia Blasingame,,actor,,Watch Movie Now >> Part 2: Who is in When Wife Won’t Forgive Movie—Meet the Cast & Their Roles Alicia Blasingame as Anne Roy When Wife Won’t Forgive main character Anne Roy was the Chairwoman of Roy Publishing.,,scraped,reelshort_fandom_cast
david-schrock,david-schrock,David Schrock,,actor,,,,scraped,reelshort_fandom_cast
constantin-cascante,constantin-cascante,Constantin Cascante,,actor,,"Watch Movie Now >> David Harris (Actor: Constantin Cascante) David Harris’s role in Don’t Mess With Supermom full movie is a reversal of what we expect from a brother. Constantin Cascante, the actor playing David Harris, has been featured in another ReelShort movie.",,scraped,reelshort_fandom_cast
troy-dillinger,troy-dillinger,Troy Dillinger,,actor,,"Robert Marley (Actor: Troy Dillinger) Robert Marley of Don’t Mess With Supermom vertical drama is the Senator’s father. Troy Dillinger, the actor behind Robert’s role, has previously been featured in many famous reels.",,scraped,reelshort_fandom_cast
just-jack,just-jack,Just Jack,,actor,,"Rovaif Babar, popularly known as Just Jack, is the actor who’s playing Jeff in The Mafia Boss Happens to Be My Sex Partner ReelShort movie.",,scraped,reelshort_fandom_cast
jonathan-barcelos,jonathan-barcelos,Jonathan Barcelos,,actor,,"Jonathan Barcelos as Louis Next up we have actor and dancer Jonathan Barcelos as Louis, who is Henry Sterling’s gay assistant.",,scraped,reelshort_fandom_cast
eric-brody,eric-brody,Eric Brody,,actor,,"As for the behind-the-scenes actor for Julien’s role, that’s Eric Brody.",,scraped,reelshort_fandom_cast
molly-van-buren,molly-van-buren,Molly Van Buren,,actor,,Film and theater actress Molly Van Buren is the face of Cindy in the Coaching His Heart ReelShort movie.,,scraped,reelshort_fandom_cast
paul-brewster,paul-brewster,Paul Brewster,,actor,,"Paul Brewster as Coach Harvey Coach Harvey, played by actor Paul Brewster, is one of Cindy’s acquaintances.",,scraped,reelshort_fandom_cast
brenna-skalski,brenna-skalski,Brenna Skalski,,actor,,,,scraped,reelshort_fandom_cast
paul-a-rossi,paul-a-rossi,Paul A. Rossi,,actor,,,,scraped,reelshort_fandom_cast
alex-mannone,alex-mannone,Alex Mannone,,actor,,,,scraped,reelshort_fandom_cast
lennon-hustad,lennon-hustad,Lennon Hustad,,actor,,"Esme (Actress: Lennon Hustad) Yearning For A Mother’s Love vertical drama acknowledges Esme as the plus-sized queen bee bully. Lennon Hustad, the 12-year-old actress behind Esme’s role, plays Esme’s spoiled nature well!",,scraped,reelshort_fandom_cast
sarah-navratil,sarah-navratil,Sarah Navratil,,actor,,"Maeve (Actress: Sarah Navratil) Yearning For A Mother’s Love movie has Maeve, a woman growing up with privileges that other people can dream of. A German actress, Sarah Navratil, plays Maeve!",,scraped,reelshort_fandom_cast
monique-parent,monique-parent,Monique Parent,,actor,,Senior actress Monique Parent will once again play the powerful maternal role!,,scraped,reelshort_fandom_cast
fabian-arnold,fabian-arnold,Fabian Arnold,,actor,,"The cast member who’s playing the mysterious billionaire Isaac Marks character in the Love Under Contract movie is Fabian Arnold, an American actor and model.",,scraped,reelshort_fandom_cast
neva-leoncini,neva-leoncini,Neva Leoncini,,actor,,,,scraped,reelshort_fandom_cast
nick-garabedian,nick-garabedian,Nick Garabedian,,actor,,"Nick Garabedian is a talented American actor whose ultimate love is acting. Be it a ruthless billionaire or werewolf roles, Nick Garabedian knows how to play these characters as real as possible.",,scraped,reelshort_fandom_cast
alexis-harris,alexis-harris,Alexis Harris,,actor,,,,scraped,reelshort_fandom_cast
mark-aaron,mark-aaron,Mark Aaron,,actor,,,,scraped,reelshort_fandom_cast
lawson-greyson,lawson-greyson,Lawson Greyson,,actor,,"Lawson Greyson as Janine Lawson Greyson is an actor, gymnast, and dancer who is originally from the mountain town of Flagstaff, AZ.",,scraped,reelshort_fandom_cast
taylor-karin,taylor-karin,Taylor Karin,,actor,,"Taylor Karin as Kate Lambert Taylor Karin is a theater, TV, and film actor.",,scraped,reelshort_fandom_cast
kiley-nicole-pearson,kiley-nicole-pearson,Kiley Nicole Pearson,,actor,,Aspect Details Full Name Kiley Nicole Pearson Profession Actor Playing Age 16-27 Height 5’5″ Weight 115 lbs 1.2 Kiley Pearson’s Collaboration With ReelShort Kiley Pearson and ReelShort’s collaboration has to be one of the highlights of 2025.,,scraped,reelshort_fandom_cast
evgenia-sinitsin,evgenia-sinitsin,Evgenia Sinitsin,,actor,,,,scraped,reelshort_fandom_cast
hayley-seat,hayley-seat,Hayley Seat,,actor,,Hayley Seat is the actor who’s playing Christin Clare in the Beg for My Return After Kicking Me Out movie.,,scraped,reelshort_fandom_cast
kazandra-santana,kazandra-santana,Kazandra Santana,,actor,,Part 4: Conclusions Part 1: Get To Know Pregnant By The Golden Billionaire Bachelor Cast & Their Characters Harper Hollinger (Actress: Kazandra Santana) Harper Hollinger initially never thought she would be Pregnant By The Golden Billionaire Bachelor. The young-looking Kazandra Santana is the actress behind Harper’s role.,,scraped,reelshort_fandom_cast
patricia-hurley,patricia-hurley,Patricia Hurley,,actor,,"Victoria Sullivan (Actress: Patricia Hurley) Victoria Sullivan’s role in Pregnant By The Golden Billionaire Bachelor movie doesn’t stop as George’s younger sister. Patricia Hurley, the actress for Victoria Sullivan’s role, might be a newcomer.",,scraped,reelshort_fandom_cast
anna-lumley,anna-lumley,Anna Lumley,,actor,,"Anna Lumley has made vertical drama fans think twice if they truly met their favorite actress. Aspects Details Full Name Anna Lumley Birthday Unknown Age 20-37 Height 5’7/170 cm Weight 110lbs/50kg Build Athletic/Toned Hair Red Eyes Blue Ethnicity White/European Descent Anna Lumley is an actor, dancer, and model currently based in Los Angeles, CA.",,scraped,reelshort_fandom_cast
antonio-douglas,antonio-douglas,Antonio Douglas,,actor,,"Antonio Douglas, the actor behind Collin Cruz’s role, is also known as Anthony Douglas.",,scraped,reelshort_fandom_cast
eve-kindall,eve-kindall,Eve Kindall,,actor,,"A newcomer actress, Eve Kindall, makes a breakthrough in The Betrayed Mother Is The Divine Heiress movie! Lena Sinclair (Actress: Eve Kindall) Lena Sinclair’s role in The Betrayed Mother Is The Divine Heiress movie is more than just a mother.",,scraped,reelshort_fandom_cast
colette-elan-caspari,colette-elan-caspari,Colette Elan Caspari,,actor,,Bella Watson (Actress: Colette Elan Caspari) Obesity affects Bella Watson’s life in The Queen Bee Strikes Back movie. Colette Elan Caspari is the actress behind Bella Watson’s role.,,scraped,reelshort_fandom_cast
jenna-flaherty,jenna-flaherty,Jenna Flaherty,,actor,,"Jessie (Actress: Jenna Flaherty) The Queen Bee Strikes Back vertical drama has Jessie as one of the NFL cheerleaders. Jenna Flaherty, the actress behind Jessie’s role, has a similar background to Colette Elan Caspari.",,scraped,reelshort_fandom_cast
ethan-j-runburg,ethan-j-runburg,Ethan J. Runburg,,actor,,,,scraped,reelshort_fandom_cast
serhii-strelnikov,serhii-strelnikov,Serhii Strelnikov,Serhiy Strelnikov,actor,,"Serhii Strelnikov is a versatile and a very popular actor who has been in the acting industry for years. Be it drama, action, or romance, Serhii Strelnikov blends in right with his roles and makes it look effortless.",,scraped,reelshort_fandom_cast
tetiana-zlova,tetiana-zlova,Tetiana Zlova,,actor,,"Tetiana Zlova is a twenty-nine-year-old actress who’s known for her beautiful brown eyes, which capture the raw emotions of her characters. Well, apart from acting, Tetiana Zlova is also a voice actress and a presenter.",,scraped,reelshort_fandom_cast
hennadii-popenko,hennadii-popenko,Hennadii Popenko,,actor,,,,scraped,reelshort_fandom_cast
evan-camacho,evan-camacho,Evan Camacho,,actor,,,,scraped,reelshort_fandom_cast
emily-sweet,emily-sweet,Emily Sweet,,actor,,,,scraped,reelshort_fandom_cast
christopher-manning,christopher-manning,Christopher Manning,,actor,,"Christopher Manning, the actor behind Joe’s role, also belongs to the 2022 edition’s Dhar Mann movie crew.",,scraped,reelshort_fandom_cast
matthew-yish,matthew-yish,Matthew Yish,,actor,,"Handsome and charismatic, Matthew Yish is brilliant in his role.",,scraped,reelshort_fandom_cast
ford-nelson,ford-nelson,Ford Nelson,,actor,,,,scraped,reelshort_fandom_cast
elijah-mahar,elijah-mahar,Elijah Mahar,,actor,,"Henry Conrad’s character is powerful, and Elijah Mahar, the actor playing Henry, is handsome, looks so tough, and takes us on an epic journey of Montana.",,scraped,reelshort_fandom_cast
pearrie-hammie,pearrie-hammie,Pearrie Hammie,,actor,,,,scraped,reelshort_fandom_cast
altar-alynne,altar-alynne,Altar Alynne,,actor,,,,scraped,reelshort_fandom_cast
xavier-gutierrez,xavier-gutierrez,Xavier Gutierrez,,actor,,"On the other hand, Xavier Gutierrez, the actor playing Roman, is handsome.",,scraped,reelshort_fandom_cast
miro-gerede-erkaya,miro-gerede-erkaya,Miro Gerede Erkaya,,actor,,,,scraped,reelshort_fandom_cast
dasha-tvoronovich,dasha-tvoronovich,Dasha Tvoronovich,Dasha Tvoronovych,actor,,"Part 1: Introducing The Year in His Chains Cast & Their Characters Dasha Tvoronovich as Anna Bieber Anna Bieber, The Year in His Chains main character is played by Dasha Tvoronovich, a Ukrainian actress.",,scraped,reelshort_fandom_cast
petro-krylov,petro-krylov,Petro Krylov,,actor,,Petro Krylov as Dimitri Cherney Actor Petro Krylov plays yet another The Year in His Chains main character.,,scraped,reelshort_fandom_cast
alex-avvakumob,alex-avvakumob,Alex Avvakumob,,actor,,,,scraped,reelshort_fandom_cast
kyle-young,kyle-young,Kyle Young,,actor,,Kyle Young portrayed the role of Mandel in this vertical series.,,scraped,reelshort_fandom_cast
nicole-crewe,nicole-crewe,Nicole Crewe,,actor,,"Nicole Crewe’s Daily Life Behind the Scene When you see Nicole on your screen, you’ll see an actress who embodies every character thrown at her. Joining Nicole Crewe in The Secret Between Us Nicole Crewe starred in The Secret Between Us, a mini-series by ReelShort.",,scraped,reelshort_fandom_cast
kate-larson,kate-larson,Kate Larson,,actor,,Kate Larson is the actress playing Brynn Maxwell.,,scraped,reelshort_fandom_cast
jesse-katz,jesse-katz,Jesse Katz,,actor,,"Speaking about the actor behind the scenes, Jesse Katz is the actor portraying Claude Saint-Jean’s character!",,scraped,reelshort_fandom_cast
kurt-merrill,kurt-merrill,Kurt Merrill,,actor,,"More specifically, we love Jarred Harper’s collaboration with Kurt Merrill, the actor behind Derek Jackson.",,scraped,reelshort_fandom_cast
jonah-robinson,jonah-robinson,Jonah Robinson,,actor,,"Jonah Robinson is one of the rising stars to watch out for in Hollywood. Jonah Robinson is an actor, creator, and video gamer who’s originally from KY but is currently based out of LA.",,scraped,reelshort_fandom_cast
charlie-wood,charlie-wood,Charlie Wood,,actor,,,,scraped,reelshort_fandom_cast
gabe-armentano,gabe-armentano,Gabe Armentano,,actor,,Gabe Armentano is the Max Brown actor in That Makes Two of Us movie who’s stealing the spotlight.,,scraped,reelshort_fandom_cast
jack-rykert,jack-rykert,Jack Rykert,,actor,,"Watch Movie Now >> Part 2: Looking At I’m Done Being a Yes-Man Main Characters and Actors Behind the Roles Jack Rykert as Enzo Quinn Enzo Quinn is the sole heir to the Quinn Corporation, one of the wealthiest million dollar empires. Jack Rykert is the I’m Done Being a Yes-Man actor shining through his powerful performances as the Quinn family heir in this revengeful drama.",,scraped,reelshort_fandom_cast
sadie-waldron,sadie-waldron,Sadie Waldron,,actor,,Sadie Waldron is the stunning actress who plays Enzo’s love interest in I’m Done Being a Yes-Man episodes.,,scraped,reelshort_fandom_cast
janey-slaten,janey-slaten,Janey Slaten,,actor,,Janey Slaten is the I’m Done Being a Yes-Man actress who’s the antagonist of this viral hit.,,scraped,reelshort_fandom_cast
mason-eaglin,mason-eaglin,Mason Eaglin,,actor,,"The movie has her working with stars like Eli Jane, Johnny Briseño, Mason Eaglin, and Ricardo Ortiz-Barreto.",,scraped,reelshort_fandom_cast
oleksandra-pankova,oleksandra-pankova,Oleksandra Pankova,,actor,,Oleksandra Pankova is the actor who plays Mary in the How to Trap President’s Son movie.,,scraped,reelshort_fandom_cast
noel-salblix,noel-salblix,Noel Salblix,,actor,,Noel Salblix is the actor playing Richard Johnson in the How to Trap President’s Son movie.,,scraped,reelshort_fandom_cast
patrick-lemon,patrick-lemon,Patrick Lemon,,actor,,"Carl Davis (Actor: Patrick Lemon) The Billionaire Janitor Is Back Vertical Drama has the power-hungry Carl Davis as the main villain. Patrick Lemon, the actor behind Carl, has quite a diversified acting portfolio!",,scraped,reelshort_fandom_cast
jessica-morris,jessica-morris,Jessica Morris,,actor,,"Emma Grayson (Actress: Jessica Morris) Amelia is the only family for Emma Grayson in The Billionaire Janitor Is Back Full Movie. Jessica Morris, the actress behind the scenes, has successfully brought Emma’s chemistry with Jack!",,scraped,reelshort_fandom_cast
rib-hillis,rib-hillis,Rib Hillis,,actor,,Jack Bradshaw (Actor: Rib Hillis) Billionaire Magnate Jack Bradshaw isn’t just the main male character of The Billionaire Janitor Is Back Full Movie.,,scraped,reelshort_fandom_cast
emily-schneider,emily-schneider,Emily Schneider,,actor,,,,scraped,reelshort_fandom_cast
maeve-jourand,maeve-jourand,Maeve Jourand,,actor,,Maeve Jourand is the actor playing The Lost Daughter’s Silent Cry character Amelia Matthews/Annabelle Walton.,,scraped,reelshort_fandom_cast
martin-boswell,martin-boswell,Martin Boswell,,actor,,Martin Boswell as Sam Mathews Martin Boswell plays yet another key role in The Lost Daughter’s Silent Cry movie.,,scraped,reelshort_fandom_cast
caroline-elizabeth-brown,caroline-elizabeth-brown,Caroline Elizabeth Brown,,actor,,Caroline Elizabeth Brown as Amy Beautiful Caroline Elizabeth Brown is the other leading actress who plays Amy in the Mother Warrior Unleashed short drama.,,scraped,reelshort_fandom_cast
christian-richardson,christian-richardson,Christian Richardson,,actor,,,,scraped,reelshort_fandom_cast
analisa-southworth-wall,analisa-southworth-wall,Analisa Southworth Wall,,actor,,,,scraped,reelshort_fandom_cast
mark-joseph-felton,mark-joseph-felton,Mark Joseph Felton,,actor,,Mark Joseph Felton is the Dan Rickshaw actor who plays the Navy SEALs captain in the Mother Warrior Unleashed movie.,,scraped,reelshort_fandom_cast
valerie-la-rose,valerie-la-rose,Valerie La Rose,,actor,,,,scraped,reelshort_fandom_cast
christina-rose,christina-rose,Christina Rose,,actor,,Karen Adams actor Christina Rose is a Los Angeles-based star who’s originally from Italy.,,scraped,reelshort_fandom_cast
alan-brifkani,alan-brifkani,Aland Brifkani,Alan Brifkani,actor,,,,scraped,reelshort_fandom_cast
harrison-keen,harrison-keen,Harrison Keen,,actor,,Harrison Keen as Daniel Roth Harrison Keen played the role of Daniel Roth.,,scraped,reelshort_fandom_cast
rocco-forrester,rocco-forrester,Rocco Forrester,,actor,,Rocco Forrester as William Katzenberg Rocco Forrester played the role of William Katzenberg.,,scraped,reelshort_fandom_cast
troy-poe,troy-poe,Troy Poe,,actor,,"Part 2: Marc Herrmann, The Actor Behind Troy Poe In Undercover Prison King Movie Part 3: Digging Deep In Troy Poe’s Backstory In Undercover Prison King Movie Part 4: Why Troy Poe’s Movie Feels Like A Must-Watch? Watch Movie Now >> Part 2: Marc Herrmann, The Actor Behind Troy Poe In Undercover Prison King Movie Isn’t it surprising that Marc Herrmann plays a leading role in Troy Poe full movie?",,scraped,reelshort_fandom_cast
emerson-hardwick,emerson-hardwick,Emerson Hardwick,,actor,,Emerson Hardwick as Chester Zimmer Emerson outdid himself playing the role of Chester Zimmer.,,scraped,reelshort_fandom_cast
scarlett-jameson,scarlett-jameson,Scarlett Jameson,,actor,,Scarlett Jameson as Marlene lynch Scarlett aced the role of Marlene Lynch.,,scraped,reelshort_fandom_cast
brooke-mccormick,brooke-mccormick,Brooke McCormick,,actor,,"Brooke McCormick Paul as Emma Wilson Meet Brooke McCormick Paul, a multitalented actor, producer, and writer who’s from San Antonio, Texas.",,scraped,reelshort_fandom_cast
nikki-hru,nikki-hru,Nikki Hru,,actor,,"Sonya (Actress: Nikki Hru) At first glance, Sonya of I Am Bloody Mary vertical drama appears like a regular maid.",,scraped,reelshort_fandom_cast
georgie-banks,georgie-banks,Georgie Banks,,actor,,,,scraped,reelshort_fandom_cast
jasmine-kheen,jasmine-kheen,Jasmine Kheen,,actor,,"Lizzie Bennet actor is the gorgeous Jasmine Kheen, a London-based actor.",,scraped,reelshort_fandom_cast
connan-aaron,connan-aaron,Connan Aaron,,actor,,Part 1: First Look At Pride & Prejudice Cast & Their Roles Connan Aaron as Mr Darcy Pride & Prejudice main character Mr.,,scraped,reelshort_fandom_cast
jacqueline-johnson,jacqueline-johnson,Jacqueline Johnson,,actor,,,,scraped,reelshort_fandom_cast
coby-obram,coby-obram,Coby Obram,,actor,,,,scraped,reelshort_fandom_cast
eleanor-louise-foushe,eleanor-louise-foushe,Eleanor Louise Foushe,,actor,,,,scraped,reelshort_fandom_cast
brooke-baxter,brooke-baxter,Brooke Baxter,,actor,,Olive Perry actor Brooke Baxter is the star to watch out for.,,scraped,reelshort_fandom_cast
quinlan-deakin,quinlan-deakin,Quinlan Deakin,,actor,,,,scraped,reelshort_fandom_cast
paige-tonkin,paige-tonkin,Paige Tonkin,,actor,,,,scraped,reelshort_fandom_cast
kylie-rohrer,kylie-rohrer,Kylie Rohrer,,actor,,"Actor, writer, and director Kylie Rohrer charms her fans with her skillful performances. The Billionaire’s Virgin Surrogate actor Kylie Rohrer, who plays Harper Jenkins, delivers a stunning performance.",,scraped,reelshort_fandom_cast
lauren-farmer,lauren-farmer,Lauren Farmer,,actor,,Watch Movie Now >> Part 2: My Mother Is A Mafia Boss Full Movie Cast and Characters Lauren Farmer As Harper Murphy My Mother Is A Mafia Boss full movie cast includes Lauren Farmer in the leading role.,,scraped,reelshort_fandom_cast
brandon-runkel,brandon-runkel,Brandon Runkel,,actor,,Brandon Runkel As Lucca Saviano Lucca Saviano role is played by the handsome Brandon Runkel.,,scraped,reelshort_fandom_cast
sayyed-shabazz,sayyed-shabazz,Sayyed Shabazz,,actor,,"Romano (Actor: Sayyed Shabazz) Romano of My Mother Is A Mafia Boss vertical drama initially appears as the Saviano brothers’ ally. The multi-talented Middle Eastern actor, Sayyed Shabazz, has successfully enlivened Romano’s characters!",,scraped,reelshort_fandom_cast
rebecca-tarabocchia,rebecca-tarabocchia,Rebecca Tarabocchia,,actor,,,,scraped,reelshort_fandom_cast
kelsey-cristina-lynn,kelsey-cristina-lynn,Kelsey Cristina Lynn,,actor,,,,scraped,reelshort_fandom_cast
amy-cray-edgell,amy-cray-edgell,Amy Cray Edgell,,actor,,,,scraped,reelshort_fandom_cast
elijah-rowen,elijah-rowen,Elijah Rowen,,actor,,"Byron Carter actor Elijah Rowen plays the leading male hero role. Elijah Rowen, Byron Carter cast is handsome and captivating in his role as a billionaire car racer.",,scraped,reelshort_fandom_cast
elena-flury,elena-flury,Elena Flury,,actor,,Elena Flury is the Cathy Lawrence actor who’s bold and powerful in her role as the mafia boss.,,scraped,reelshort_fandom_cast
cristina-ranslem,cristina-ranslem,Cristina Ranslem,,actor,,,,scraped,reelshort_fandom_cast
jason-caceres,jason-caceres,Jason Caceres,,actor,,,,scraped,reelshort_fandom_cast
nikita-kirillov,nikita-kirillov,Nikita Kirillov,,actor,,"Ivan Kalichnov (Actor: Nikita Kirillov) Ivan Kalichnov of Secret Boss Of The Five Keys vertical drama used to be a syndicate member. The Kyrgyzstan-born actor, Nikita Kirillov, executes Ivan’s role well!",,scraped,reelshort_fandom_cast
hailey-swartwout,hailey-swartwout,Hailey Swartwout,,actor,,"Vanessa Russo (Actress: Hailey Swartwout) Vanessa Rodgers of Secret Boss Of The Five Keys full episodes used to be Vanessa Russo. Styling is the ultimate expertise of Hailey Swartwout, the actress behind Vanessa’s role.",,scraped,reelshort_fandom_cast
callahan-teceno,callahan-teceno,Callahan Teceno,,actor,,"Callahan Teceno as Adam Teceno, the actor known for starring in My Vampire System, plays Adam in Submitting to My Ex’s Dad.",,scraped,reelshort_fandom_cast
noah-blake,noah-blake,Noah Blake,,actor,,,,scraped,reelshort_fandom_cast
john-jamieson-michaels,john-jamieson-michaels,John Jamieson Michaels,,actor,,"Aspect Details Full Name John Jamieson Michaels Profession Actor, Model Age 33 1.2 J.J.",,scraped,reelshort_fandom_cast
andrea-harhoff,andrea-harhoff,Andrea Harhoff,,actor,,,,scraped,reelshort_fandom_cast
cast-jade-lee,cast-jade-lee,Cast Jade Lee,,actor,,,,scraped,reelshort_fandom_cast
jade-lee,jade-lee,Jade Lee,,actor,,Jade Lee as Alice Vega Jade Lee might be a new actress in The Elite Heir’s Ultimate Comeback drama.,,scraped,reelshort_fandom_cast
cast-phil-moore,cast-phil-moore,Cast Phil Moore,,actor,,,,scraped,reelshort_fandom_cast
cast-jacob-born,cast-jacob-born,Cast Jacob Born,,actor,,Watch Movie Now >> Cast Jacob Born as Dylan The Elite Heir’s Ultimate Comeback drama has a manipulative villain.,,scraped,reelshort_fandom_cast
cast-joshua-mehmet,cast-joshua-mehmet,Cast Joshua Mehmet,,actor,,,,scraped,reelshort_fandom_cast
alexandra-pankova,alexandra-pankova,Alexandra Pankova,,actor,,"The full-time Russian actress, Alexandra Pankova, has captivated audiences’ minds by filling Cindy’s role magnificently since the first three episodes.",,scraped,reelshort_fandom_cast
daniel-jongma,daniel-jongma,Daniel Jongma,,actor,,"Daniel Jongma as Christian Edward A Matter of Sin and Love actor name of the main male protagonist is Daniel Jongma, a Sydney-based actor, model, and singer. Daniel Jongma is an easy-going, passionate aspiring actor who came from a known drama school where he earned considerable knowledge about the true art of acting.",,scraped,reelshort_fandom_cast
tamra-paselk,tamra-paselk,Tamra Paselk,,actor,,"Some of the movies he has starred in include “Behind the Line,” “Wide Sea,” and “Ghost Punchers.” Tamra Paselk as Blair Vance Tamira Paselk played the role of Blair Vance, Spencer’s mom and Damon’s rival. Tamra Paselk is an actress, producer, and writer known for “Law & Order, Organised Crime,” “Bronx’ish,” “The Girl in the Straw Hat,” “Good Morning,” and “Chronicles of a Bleep Year Old Woman.” Watch Movie Now >> Part 2.",,scraped,reelshort_fandom_cast
marc-schottner,marc-schottner,Marc Schottner,,actor,,"Some of her movies include “Killing the Canary,” “The Divorced Billionaire Heiress,” “The Unwanted Heiress,” and “The Substitute Bride.” Marc Schottner as Damon Ford Born on December 29, 1986, Marc Schottner is an American and German citizen.",,scraped,reelshort_fandom_cast
emilio-picayo,emilio-picayo,Emilio Picayo,,actor,,,,scraped,reelshort_fandom_cast
cast-noah-fearnley,cast-noah-fearnley,Cast Noah Fearnley,,actor,,,,scraped,reelshort_fandom_cast
cast-hannah-record,cast-hannah-record,Cast Hannah Record,,actor,,,,scraped,reelshort_fandom_cast
cast-kathryn-cima,cast-kathryn-cima,Cast Kathryn Cima,,actor,,,,scraped,reelshort_fandom_cast
cast-mark-pontarelli,cast-mark-pontarelli,Cast Mark Pontarelli,,actor,,Cast Mark Pontarelli as Ryan Ryan of Love On The Sidelines movie plays the role of Karl’s assistant.,,scraped,reelshort_fandom_cast
sonia-sayani,sonia-sayani,Sonia Sayani,,actor,,"Sonia Sayani, the actress behind Evie’s role, has played in several other movies since 2018.",,scraped,reelshort_fandom_cast
jeff-violette,jeff-violette,Jeff Violette,,actor,,"As for the actor behind the scenes, we acknowledge Jeff Violette as the figure!",,scraped,reelshort_fandom_cast
zeng-hui,zeng-hui,Zeng Hui,,actor,,Zeng Hui as Max Spencer Zeng Hui is the actor of Love in the Twilight Breeze that delivered us Max Spencer.,,scraped,reelshort_fandom_cast
han-yutong,han-yutong,Han Yutong,,actor,,"Part 1: Love in the Twilight Breeze Cast and Characters Introduction Han Yutong as Ava Grace The main protagonist, Ava Grace, is played by the cast of Love in the Twilight Breeze, a famous Chinese actress, Han Yutong.",,scraped,reelshort_fandom_cast
liz-fenning,liz-fenning,Liz Fenning,,actor,,,,scraped,reelshort_fandom_cast
regine-bautista,regine-bautista,Regine Bautista,,actor,,,,scraped,reelshort_fandom_cast
amalea-joy-sanchez,amalea-joy-sanchez,Amalea Joy Sanchez,,actor,,,,scraped,reelshort_fandom_cast
dan-cropley,dan-cropley,Dan Cropley,,actor,,Dan Cropley as Craig The Australian actor loved being in front of the cameras since 2009.,,scraped,reelshort_fandom_cast
macy-minear,macy-minear,Macy Minear,,actor,,"Watch Movie Now >> Part 2: The Divorce Me One Last Time Cast and Characters Macy Minear as Hallie The young and promising actress and dancer, Macy Minear is known for starring in Xanadu Hellfire, Hurtcore, Remember, Love, Deadly Cheers.",,scraped,reelshort_fandom_cast
zemi-hively,zemi-hively,Zemi Hively,,actor,,"Zemi Hively as Natalie The youngest Divorce Me One Last Time actress, Zemi, is one talented girl.",,scraped,reelshort_fandom_cast
jack-turner,jack-turner,Jack Turner,,actor,,"Jack Turner as Ned Divorce Me One Last Time actor Jack Turner has been credited for a great deal of tv commercials, films and video games.",,scraped,reelshort_fandom_cast
abby-burris,abby-burris,Abby Burris,,actor,,Part 2: Meet Unexpected Knot Married to a Billionaire Nurse Full Movie Actor & Characters Abby Burris as Madeline Madeline is the main protagonist of Unexpected Knot: Married to a Billionaire Nurse full movie.,,scraped,reelshort_fandom_cast
