person_id,slug,name,aka_names,role_type,socials,bio_short,photo_ref,data_confidence,source
andrew-wolf,andrew-wolf,Andrew Wolf,,actor,,Andrew Wolf as Milo Swann The cutest Andrew Wolf plays Milo’s role in Wings of Fire The Dragon Slayer Is My Ex-Lover short drama.,,scraped,reelshort_fandom_cast
lisa-king,lisa-king,Lisa King,,actor,,"1.5 Lisa King as Marie Brooks Marie Brooks is Julian’s mother, who adds nuance in this film.",,scraped,reelshort_fandom_cast
sal-rendino,sal-rendino,Sal Rendino,,actor,,,,scraped,reelshort_fandom_cast
karina-achaeva,karina-achaeva,Karina Achaeva,,actor,,"Karina Achaeva is a twenty-eight-year-old New York-based Russian actress, influencer, and content creator. Given her versatility, it didn’t take long for Karina Achaeva to bag the leading role.",,scraped,reelshort_fandom_cast
greg-schweers,greg-schweers,Greg Schweers,,actor,,Lane Tied to My Dangerous Mafia Husband cast Greg Schweers is seen in a supporting role as Dr.,,scraped,reelshort_fandom_cast
nate-hinson,nate-hinson,Nate Hinson,,actor,,,,scraped,reelshort_fandom_cast
nathaniel-hinson,nathaniel-hinson,Nathaniel Hinson,,actor,,"Watch Movie Now >> Part 4: Conclusion & Similar Movie Recommendation Nathaniel Hinson, Tied to My Dangerous Mafia Husband cast was impressive in his role as a don.",,scraped,reelshort_fandom_cast
jeremiah-blakely,jeremiah-blakely,Jeremiah Blakely,,actor,,movie is one of the web series-adapted movies that actor Jeremiah Blakely has starred in.,,scraped,reelshort_fandom_cast
kelsey-ann-maskell,kelsey-ann-maskell,Kelsey Ann Maskell,,actor,,,,scraped,reelshort_fandom_cast
macy-faith-boren,macy-faith-boren,Macy Faith Boren,,actor,,"The movie has stars like Macy Faith Boren and Kasey Esser acting as the protagonists, Emma and Oliver, respectively.",,scraped,reelshort_fandom_cast
seth-s-carroll,seth-s-carroll,Seth S. Carroll,,actor,,,,scraped,reelshort_fandom_cast
rose-hough,rose-hough,Rose Hough,,actor,,"Rose Hough, the actress behind Linda’s presence in Lady CEO’s Revenge movie, is sometimes also known as Emily Hough.",,scraped,reelshort_fandom_cast
kerttu-karon,kerttu-karon,Kerttu Karon,,actor,,,,scraped,reelshort_fandom_cast
william-thomas-jones,william-thomas-jones,William Thomas Jones,,actor,,,,scraped,reelshort_fandom_cast
jake-galluccio,jake-galluccio,Jake Galluccio,,actor,,Jake Galluccio is the actor playing Alpha Liam.,,scraped,reelshort_fandom_cast
lx-xander,lx-xander,LX Xander,,actor,,,,scraped,reelshort_fandom_cast
stacey-marie-keba,stacey-marie-keba,Stacey Marie Keba,,actor,,"The big question you’ve all been asking and waiting to be answered is “Who is Stacey Marie Keba in reality?” Stacey Marie Keba is an American actress from Doylestown, Pennsylvania. Joining Stacey Marie Keba in How to Tame a Silver Fox Stacey Marie Keba starred in ReelShort’s How to Tame a Silver Fox as Christina Fawkes.",,scraped,reelshort_fandom_cast
timothy-krabill,timothy-krabill,Timothy Krabill,,actor,,,,scraped,reelshort_fandom_cast
c-j-hammond,c-j-hammond,C.J. Hammond,,actor,,,,scraped,reelshort_fandom_cast
ashley-beloat,ashley-beloat,Ashley BeLoat,,actor,,Ashley BeLoat as Candace Gray Ashley BeLoat’s imposing figure and facial expression led her to be cast as the main antagonist in most of her starred movies.,,scraped,reelshort_fandom_cast
jesse-gallagher,jesse-gallagher,Jesse Gallagher,,actor,,,,scraped,reelshort_fandom_cast
nick-mauldin,nick-mauldin,Nick Mauldin,,actor,,"Nick Mauldin, el actor principal que interpreta a Eric Lockwood, el ex prometido de Kristine Wilson, no solo es un gran cantante.",,scraped,reelshort_fandom_cast
casie-maghran,casie-maghran,Casie Maghran,,actor,,Ver Ahora >> Casie Maghran como Gianna Wilson Frecuentemente vemos actores y actrices que también tienen roles de modelaje o sesiones de fotos cuando no están actuando.,,scraped,reelshort_fandom_cast
meg-elizabeth,meg-elizabeth,Meg Elizabeth,,actor,,Watch Movie Now >> Part 2: Meet Maid For My Nemesis Full Movie Cast & Crew Meg Elizabeth as Emma Johnson Meg Elizabeth is the casting actress for Emma Johnson’s role in the upcoming Maid For My Nemesis movie on ReelShort.,,scraped,reelshort_fandom_cast
david-eve,david-eve,David Eves,David Eve,actor,,"Real-world-wise, Rogue Xavier has David Eves as the actor.",,scraped,reelshort_fandom_cast
sarah-channel,sarah-channel,Sarah Channel,,actor,,"Who Is Emma Hullar, The Actress Behind Sarah Channel?",,scraped,reelshort_fandom_cast
sarah-james,sarah-james,Sarah James,,actor,,,,scraped,reelshort_fandom_cast
michael-vaccaro,michael-vaccaro,Michael Vaccaro,,actor,,,,scraped,reelshort_fandom_cast
ana-carrasquillo,ana-carrasquillo,Ana Carrasquillo,,actor,,,,scraped,reelshort_fandom_cast
alex-barlas,alex-barlas,Alex Barlas,,actor,,"Dylan Maxwell (Actor: Alex Barlas) Dylan Maxwell of Gold Digging Bride’s Fatal Mistake vertical drama used to be a model agency’s manager. Interestingly, Alex Barlas, the actor behind Dylan’s role, also has extensive modeling experience.",,scraped,reelshort_fandom_cast
jarrid-balis,jarrid-balis,Jarrid Balis,,actor,,,,scraped,reelshort_fandom_cast
cosette-hatch,cosette-hatch,Cosette Hatch,,actor,https://www.imdb.com/name/nm5146959/,"Watch Movie Now >> Part 2: Racing Into Love With My Secret Boss Movie Main Cast Introduction Kate Smith (Actress: Cosette Hatch) Money motivates Kate Smith in Racing Into Love With My Secret Boss vertical drama. The world primarily acknowledges Cosette Hatch, the actress behind Kate’s role, as a competitive figure skater.",https://v-mps.crazymaplestudios.com/images/450519b0-2caa-11f0-93de-cb0b88a6d7a9.jpg,scraped,reelshort_fandom_cast
sophie-woodward,sophie-woodward,Sophie Woodward,,actor,,Sophie Woodward as Bianca Smithe Sophie Woodward is a beautiful actress who plays Bianca in The Senator’s Son.,,scraped,reelshort_fandom_cast
kimberly-mcclain,kimberly-mcclain,Kimberly McClain,,actor,,"As the behind-the-scene actress, we expect Kimberly McClain to not only do a brilliant acting job for Emma’s roles!",,scraped,reelshort_fandom_cast
jake-elliot,jake-elliot,Jake Elliot,,actor,,Jake Elliot Slaughter is the actor behind Grayson’s role.,,scraped,reelshort_fandom_cast
eloise-gordon,eloise-gordon,Eloise Gordon,,actor,,"Eloise Gordon as Lilith Jones Los Angeles-based actor Eloise Gordan, known for her roles in “End of the World, Start of My Empire” and “The Virgin Camp Counselor” movies, plays Lilith Jones in this ReelShort’s latest drama.",,scraped,reelshort_fandom_cast
vincent-marquez,vincent-marquez,Vincent Marquez,,actor,,,,scraped,reelshort_fandom_cast
olivia-benedict,olivia-benedict,Olivia Benedict,,actor,,,,scraped,reelshort_fandom_cast
andrea-adamson,andrea-adamson,Andrea Adamson,,actor,,,,scraped,reelshort_fandom_cast
marcus-brodie,marcus-brodie,Marcus Brodie,,actor,,,,scraped,reelshort_fandom_cast
dre-daivs,dre-daivs,Dre Daivs,,actor,,,,scraped,reelshort_fandom_cast
ren-muccino,ren-muccino,Ren Muccino,,actor,,,,scraped,reelshort_fandom_cast
ethan-vaughan,ethan-vaughan,Ethan Vaughan,,actor,,,,scraped,reelshort_fandom_cast
ian-michaels,ian-michaels,Ian Michaels,,actor,,"Ian Michaels as Shane Grant The actor known for Back to the 8 Count and Innocent Boy plays Shane Grant, the hospital’s director, and Bella’s official boyfriend.",,scraped,reelshort_fandom_cast
tyler-crosby,tyler-crosby,Tyler Crosby,,actor,,"Tyler Crosby as Grady Tyler Crosby is known for starring movies such as Lose You to Love Me, Sky Dancers Grown Up, Cass Half Full, Something Stolen.",,scraped,reelshort_fandom_cast
annette-saunders,annette-saunders,Annette Saunders,,actor,,,,scraped,reelshort_fandom_cast
patrick-wade,patrick-wade,Patrick Wade,,actor,,Actor de reparto: Patrick Wade Patrick Wade es un actor aspirante conocido por su trabajo en las series de televisión MacGyver y Bad Together.,,scraped,reelshort_fandom_cast
cody-sean-morgan,cody-sean-morgan,Cody Sean Morgan,,actor,,,,scraped,reelshort_fandom_cast
ian-hummel,ian-hummel,Ian Hummel,,actor,,,,scraped,reelshort_fandom_cast
rachel-goodwin,rachel-goodwin,Rachel Goodwin,,actor,,,,scraped,reelshort_fandom_cast
robert-rice,robert-rice,Robert Rice,,actor,,Emerson Hardwick (Actor: Robert Rice) Emerson Hardwick of Chained To My Prison Guard movie is the brain behind Scarlett’s imprisonment. Robert Rice is the real-world actor identity for Emerson.,,scraped,reelshort_fandom_cast
courtney-angelica-coffey,courtney-angelica-coffey,Courtney Angelica Coffey,,actor,,Zoey (Actress: Courtney Angelica Coffey) Zoey of Chained To My Prison Guard movie is the first introduced inmate for Scarlett.,,scraped,reelshort_fandom_cast
clay-wilde,clay-wilde,Clay Wilde,,actor,,"Speaking about the real-world actor identity, Clay Wilde is the individual.",,scraped,reelshort_fandom_cast
hannah-ponsford,hannah-ponsford,Hannah Ponsford,,actor,,"Hannah Ponsford, the actress behind Evonne’s role, also has only played in at least two other movies.",,scraped,reelshort_fandom_cast
cody-critcher,cody-critcher,Cody Critcher,,actor,,,,scraped,reelshort_fandom_cast
yausmenda-freeman,yausmenda-freeman,Yausmenda Freeman,,actor,,"Yausmenda Freeman as Grace Yausmenda Freeman, the actress playing Grace in The Lady Boss’s Small Town Valentine, is known for Still Bout It, Black Love.",,scraped,reelshort_fandom_cast
timothy-ceiley,timothy-ceiley,Timothy Ceiley,,actor,,"Timothy Ceiley as Kevin Timothy is an Australian actor with experience in various dramas, short films, TV adds and stage productions.",,scraped,reelshort_fandom_cast
brieana-mayne,brieana-mayne,Brieana Mayne,,actor,,"Brieana Mayne as Rachel The young and beautiful actress Brieana Mayne stars in movies such as The Day We Got Married, Divorce to Be the Top Heiress, and Candy Cane Lane.",,scraped,reelshort_fandom_cast
andre-adams,andre-adams,Andre Adams,,actor,,"Andre Adams is a Jamaican-American actor, mostly well-known for his key roles in several mini-series and feature films.",,scraped,reelshort_fandom_cast
elisha-davis,elisha-davis,Elisha Davis,,actor,,,,scraped,reelshort_fandom_cast
ana-auggiero,ana-auggiero,Ana Auggiero,,actor,,,,scraped,reelshort_fandom_cast
romina-follinus,romina-follinus,Romina Follinus,Romina Follionus,actor,,,,scraped,reelshort_fandom_cast
miguel-browne,miguel-browne,Miguel Browne,,actor,,The newcomer actor’s Miguel Browne impeccable acting skills contribute to Luke’s expressive dialogues throughout the movie.,,scraped,reelshort_fandom_cast
braxton-angle,braxton-angle,Braxton Angle,,actor,,My Dear Daughter Love Me Once More is ReelShort ‘s exclusive vertical movie featuring stunning actors like Braxton Angle and Kelsey Maskell in the leading roles. This toxic husband and father is played by the very handsome and talented actor Braxton Angle.,,scraped,reelshort_fandom_cast
samy-peeters,samy-peeters,Samy Peeters,,actor,,"Samy Peeters, the actor playing Andrew, is not a new actor.",,scraped,reelshort_fandom_cast
nehaal-mohammed,nehaal-mohammed,Nehaal Mohammed,,actor,,"The actor behind Calvin’s role is Nehaal Mohammed. Like Nehaal Mohammed, this romance movie is by far his only starred movie.",,scraped,reelshort_fandom_cast
adriana-olivares-h,adriana-olivares-h,Adriana Olivares H.,,actor,,"Adriana Olivares H., the actress behind Isabella Smith, has also played in another movie.",,scraped,reelshort_fandom_cast
fanny-lavoie,fanny-lavoie,Fanny Lavoie,,actor,,Fanny Lavoie has done a decent job in filling Nia’s roles.,,scraped,reelshort_fandom_cast
emile-auger,emile-auger,Emile Auger,,actor,,"The Canadian-born actor, Emile Auger, plays Richard.",,scraped,reelshort_fandom_cast
agathe-levi,agathe-levi,Agathe Levi,,actor,https://www.imdb.com/name/nm7129119/,"Agathe Levi plays the lead female role in Genius Baby Gets Daddy Back Movie . In 2022, Agathe Levi’s acting career bloomed to the fullest where she had three outstanding movies in her portfolio.",https://v-mps.crazymaplestudios.com/images/928ddf90-2ca6-11f0-93de-cb0b88a6d7a9.jpg,scraped,reelshort_fandom_cast
riley-joseph-nottingham,riley-joseph-nottingham,Riley Joseph Nottingham,,actor,,,,scraped,reelshort_fandom_cast
julia-a-mason,julia-a-mason,Julia A. Mason,,actor,,,,scraped,reelshort_fandom_cast
emily-gateley,emily-gateley,Emily Gateley,,actor,,"Emily Gateley is a Los Angeles-based actress and model. She has won awards such as the “Best Young Actress” award and “Audience Choice Award.” Some of Emily Gateley movies and TV shows you should see are You’ve Got Male , Burn It All, and The Last Gambling God .",,scraped,reelshort_fandom_cast
nic-westaway,nic-westaway,Nic Westaway,,actor,,"Watch Movie Now >> Speaking of Alpha Ed, Nic Westaway is the actor behind this heartless and misunderstood Alpha.",,scraped,reelshort_fandom_cast
kaydin-gibson,kaydin-gibson,Kaydin Gibson,,actor,,Kaydin Gibson as Darius Winslow Kaydin Gibson joins the Creation Itself is Love movie YouTube as the actor who plays Darius Winslow.,,scraped,reelshort_fandom_cast
sophie-goron,sophie-goron,Sophie Goron,,actor,,,,scraped,reelshort_fandom_cast
morgan-foster,morgan-foster,Morgan Foster,,actor,,"Morgan Foster, the actress playing Camilla, is yet another new face you will see in this upcoming movie.",,scraped,reelshort_fandom_cast
john-patrick-hart,john-patrick-hart,John Patrick Hart,,actor,,"John Patrick Hart, the actor casting as Daniel, is also known as John Hart.",,scraped,reelshort_fandom_cast
griffin-winter,griffin-winter,Griffin Winter,,actor,,Brooks Whitmore (Actor’s Name: Griffin Winter) Brooks Whitmore is a prominent figure in Park Avenue Girls Don’t Play Nice drama as the main love interest and as the moral compass.,,scraped,reelshort_fandom_cast
skylar-fast,skylar-fast,Skylar Fast,,actor,,,,scraped,reelshort_fandom_cast
david-blindauer,david-blindauer,David Blindauer,,actor,,"No casting is better than playing the actor’s alternative self, and that’s what we will see in David Blindauer, the actor cast as David Brus in The Devil Wears Desire short drama.",,scraped,reelshort_fandom_cast
tatyana-ravena,tatyana-ravena,Tatyana Ravena,,actor,,"Tatyana Ravena as Alma Got Pregnant with Ex-Boss’s Baby main protagonist, Alma, is potrayed by Tatyana Ravena, a hispanic, writer, singer, actor and arts administrator.",,scraped,reelshort_fandom_cast
nicholas-garabedian,nicholas-garabedian,Nicholas Garabedian,,actor,,Nicholas Garabedian plays the role of Harrison Hudson.,,scraped,reelshort_fandom_cast
lindsie-kongsore,lindsie-kongsore,Lindsie Kongsore,,actor,,"Lindsie Kongsore as Tina Got Pregnant with Ex-Boss’s Baby actor Tina is Lindsie Kongsore, a Los Angeles-based actress, singer and musician.",,scraped,reelshort_fandom_cast
sabrina-rault,sabrina-rault,Sabrina Rault,,actor,,Watch Movie Now >> Part 2: Get To Know The Heiress’s Blind Love Main Character/Cast Sabrina Rault as Ava Green Sabrina Rault played the role of Ava Green.,,scraped,reelshort_fandom_cast
olivia-fildes,olivia-fildes,Olivia Fildes,,actor,,"A drunken one-night stand, a lost dog tag, and mistaken identity— I Leashed A CEO full movie is a romantic entertainer featuring Olivia Fildes and Dan Jongma in the leading roles. Part 1: Introducing The I Leashed A CEO Cast & Their Characters Olivia Fildes as Sarah Clark Melbourne Melbourne-based actress and director Olivia Fildes plays I Leashed A CEO main character Sarah Clark.",,scraped,reelshort_fandom_cast
hilary-boyce,hilary-boyce,Hilary Boyce,,actor,,Hilary Boyce Hilary Boyce plays the antagonist role of Nancy in the Fired Framed and Fierce movie.,,scraped,reelshort_fandom_cast
tommi-krasic,tommi-krasic,Tommi Krasic,,actor,,"Tommi Krasic Actor, writer, and director Tommi Krasic plays Nolan Blair in the Fired Framed and Fierce drama.",,scraped,reelshort_fandom_cast
skyla-lynne,skyla-lynne,Skyla Lynne,,actor,,"Eleanor Westchester (Actress: Skyla Lynne) Eleanor of American Sniper The Kid Of Guns full movie barely holds rifles or any kind of weapons. Speaking of Eleanor’s behind-the-scenes actress, we can say that it’s rare for Skyla Lynne to play the MC.",,scraped,reelshort_fandom_cast
robert-keefe,robert-keefe,Robert Keefe,,actor,,Bradley “Brad” Westchester (Actor: Robert Keefe) American Sniper The Kid Of Guns full movie’s story emphasizes that people around Bradley call him Brad.,,scraped,reelshort_fandom_cast
stella-sabbatini,stella-sabbatini,Stella Sabbatini,,actor,,"Erica (Actress: Stella Sabbatini) One Night Or Forever full movie, portrays Erica as the actual homewrecker. Stella Sabbatini, the actress playing Erica’s role, might have just started her debut in this ReelShort movie.",,scraped,reelshort_fandom_cast
oleg-starodubstev,oleg-starodubstev,Oleg Starodubstev,,actor,,Henry Sterling (Actor: Oleg Starodubstev) One Night Or Forever full movie story portrays Henry Sterling as a seemingly loving guy with a rotten heart. The Russian actor Oleg Starodubstev not only plays Henry’s dialogues well when he degrades and confuses Kate.,,scraped,reelshort_fandom_cast
mckenna-prill,mckenna-prill,McKenna Prill,,actor,,"Kate Sterling (Actress: McKenna Prill) One Night Or Forever vertical drama ’s stories highlight Kate as an amazing dancer who also knows a lot about antidote. McKenna Prill, as Kate’s behind-the-scenes actress, receives praise for her portrayal of Kate’s struggles.",,scraped,reelshort_fandom_cast
chris-stonebraker,chris-stonebraker,Chris Stonebraker,,actor,,Don Arturo Adolfi (Actor: Chris Stonebraker) Mafia Princess Returns full movie’s characters respect and fear Don Arturo Adolfi not only because of his patriarch status.,,scraped,reelshort_fandom_cast
neven-tomic,neven-tomic,Neven Tomic,,actor,https://www.imdb.com/name/nm2977096/,Enzo Adolfi (Actor: Neven Tomic) Being a first-born son means Enzo of the Mafia Princess Returns vertical drama should be the Adolfi family’s heir. Neven Tomic nails the most brilliant and likeable role when he takes Enzo Adolfi’s role.,https://v-mps.crazymaplestudios.com/images/a5967230-2cad-11f0-93de-cb0b88a6d7a9.jpg,scraped,reelshort_fandom_cast
jane-murdoch,jane-murdoch,Jane Murdoch,,actor,,"As for Francesca’s actress, Jane Murdoch has executed her dialogues well.",,scraped,reelshort_fandom_cast
annastasia-marie,annastasia-marie,Annastasia Marie,,actor,,"Giana Adolfi (Actress: Annastasia Marie) The spoiled Giana of Mafia Princess Returns feels high and mighty when it comes to her position in the family. Annastasia Marie, the actress who plays Giana’s manipulative role, has also played Giana’s tactics well.",,scraped,reelshort_fandom_cast
danney-clawson,danney-clawson,Danney Clawson,,actor,,Watch Movie Now >> Danney Clawson as General Hawthorne Actor Danney Clawson plays General Hawthorne in the Death Touch movie.,,scraped,reelshort_fandom_cast
nick-lunetta,nick-lunetta,Nick Lunetta,,actor,,"Nick Lunetta as Ronan Bragg/Iron Ghost Nick Lunetta is an American actor, singer, and vocalist.",,scraped,reelshort_fandom_cast
kulani-seward,kulani-seward,Kulani Seward,,actor,,"Kulani Seward as Taycee Monroe Actor, singer, and dancer Kulani Seward plays Taycee Monroe in the Death Touch movie.",,scraped,reelshort_fandom_cast
emma-rose-ball,emma-rose-ball,Emma Rose Ball,,actor,,,,scraped,reelshort_fandom_cast
amanda-w-sutton,amanda-w-sutton,Amanda W. Sutton,,actor,,,,scraped,reelshort_fandom_cast
gabriel-jayne,gabriel-jayne,Gabriel Jayne,,actor,,"Gabriel Jayne as Julian Mancini Actor, musician, and songwriter Gabriel Jayne is one of the hottest vertical lads.",,scraped,reelshort_fandom_cast
sarah-krawczyk,sarah-krawczyk,Sarah Krawczyk,,actor,,"Sarah Krawczyk as Caitlin Every story has a villain and Sarah Krawczyk played the role of Caitlin, one of the antagonists in the Things I Wanted To Say ReelShort movie.",,scraped,reelshort_fandom_cast
ryan-koch,ryan-koch,Ryan Koch,,actor,,"Elliot (Actor: Ryan Koch) The disheveled-looking Elliot of Things I Wanted To Say vertical drama is one of Lancaster Prep’s bullies. Ryan Koch might be a newcomer actor, but he has portrayed Elliot’s despicable personality well.",,scraped,reelshort_fandom_cast
raina-silver,raina-silver,Raina Silver,,actor,,Sylvie Lancaster (Actress: Raina Silver) Things I Wanted To Say vertical drama clarifies Sylvie Lancaster’s status as Whit’s little sister. Raina Silver plays Sylvie’s strong-willed younger sister and BFF role brilliantly!,,scraped,reelshort_fandom_cast
pablo-kaestli,pablo-kaestli,Pablo Kaestli,,actor,https://www.imdb.com/name/nm12554265/,"Pablo Kaestli as Whit Lancaster Pablo Kaestli played the role of Whit, the son of Augustus and Sylvia Lancaster.",https://v-mps.crazymaplestudios.com/images/b9d8a0a0-b2d7-11f0-a06b-bdb674869ea1.jpg,scraped,reelshort_fandom_cast
richard-neil,richard-neil,Richard Neil,,actor,,"Dante (Actor: Richard Neil) Nero Made Men, a full movie, portrays Dante as Nero and Lucca’s overbearing father. The senior actor behind Dante’s role, Richard Neil, has played in more than 150 movies.",,scraped,reelshort_fandom_cast
anna-surdina,anna-surdina,Anna Surdina,,actor,,Anna Surdina as Ella Reid Los Angeles actress and singer Anna Surdina plays Ella Reid.,,scraped,reelshort_fandom_cast
janelle-yull,janelle-yull,Janelle Yull,,actor,,"Behind the scenes, it’s Janelle Yull, the actor, producer, singer, and dancer who plays Marina Voss in the Rise of the Caged King movie.",,scraped,reelshort_fandom_cast
katelyn-rose,katelyn-rose,Katelyn Rose,,actor,,Katelyn Rose as Nora Weston Actor and internet personality Katelyn Rose plays Nora Weston in Rise of the Caged King movie.,,scraped,reelshort_fandom_cast
leila-collins,leila-collins,Leila Collins,,actor,,,,scraped,reelshort_fandom_cast
joel-erdmann,joel-erdmann,Joel Erdmann,,actor,,"Part 1: Closer Look At My X-Ray Vision Sees Right Through You Cast & Their Characters Joel Erdmann as Eric Dawson Actor, model, internet personality, and dancer Joel Erdmann plays My X-Ray Vision Sees Right Through You main character Eric Dawson. As Eric Dawson, Joel Erdmann plays the mysterious CEO who was born with X-ray supervision.",,scraped,reelshort_fandom_cast
belle-moskowitz,belle-moskowitz,Belle Moskowitz,,actor,,"Belle Moskowitz as Katie Roberts Actor, dancer, and model Belle Moskowitz is yet another stunning talent to watch out for.",,scraped,reelshort_fandom_cast
garrison-dunn,garrison-dunn,Garrison Dunn,,actor,,"Garrison Dunn as Miles Pickett Garrison Dunn is a twenty-five-year-old actor, model, and TikTok star.",,scraped,reelshort_fandom_cast
lacey-tuell,lacey-tuell,Lacey Tuell,,actor,,"Lacey Tuell as Bekah Aspiring actress Lacey Tuell, known for her roles in “I Love You More Than Life” and “Mistaken as his Mate: The Luna’s Regret,” is part of the star-studded The Seduction Game cast lineup.",,scraped,reelshort_fandom_cast
noah-andre,noah-andre,Noah Andre,,actor,,"Noah Andre is a twenty-two-year-old actor, singer, and songwriter. A year after his graduation, Noah Andre moved to LA, taking a big risk, which eventually paid off as this multi-talented and handsome actor soon landed amazing projects to shine in.",,scraped,reelshort_fandom_cast
spencer-palmer,spencer-palmer,Spencer Palmer,,actor,,"Daxon Adams (Actor: Spencer Palmer) Daxon of The Hidden Empire Of Stephen Adams might look like a poor, weak, but somewhat lucky guy. Spencer Palmer, the one who plays Daxon’s role, has previously appeared in ReelShort ’s BL movie, Poolboy .",,scraped,reelshort_fandom_cast
sasha-randoll,sasha-randoll,Sasha Randoll,,actor,,Laura Hale (Actress: Sasha Randoll) The Hidden Empire Of Stephen Adams vertical drama narrates Laura Hale as Daxon’s loving girlfriend.,,scraped,reelshort_fandom_cast
mitchell-greene,mitchell-greene,Mitchell Greene,,actor,,Mitchell Greene as Darian Actor Mitchell Greene is one of the emerging talents to watch.,,scraped,reelshort_fandom_cast
francisco-decun,francisco-decun,Francisco DeCun,,actor,,"Francisco DeCun as Shawn Carter Born in Puerto Rico, Francisco DeCun is an actor, musician, and an artist based out of LA.",,scraped,reelshort_fandom_cast
erin-taylor,erin-taylor,Erin Taylor,,actor,,,,scraped,reelshort_fandom_cast
bella-marz,bella-marz,Bella Marz,,actor,,Bella Marz as Grace Actress Bella Marz plays Grace in the Models vs.,,scraped,reelshort_fandom_cast
alexa-reddy,alexa-reddy,Alexa Reddy,,actor,https://www.imdb.com/name/nm5879789/,"Alexa Reddy as Nelly Alexa Reddy is a twenty two-year old American actress. Werewolves cast lineup, Alexa Reddy plays Nelly, a true sweetheart and a popular model whose gateway with friends turns deadly.",https://v-mps.crazymaplestudios.com/actorIMG/da4a8840e39d81c8actor.jpg,scraped,reelshort_fandom_cast
hannah-hueston,hannah-hueston,Hannah Hueston,,actor,,Actor and dancer Hannah Hueston is the face of Nikki in Models vs.,,scraped,reelshort_fandom_cast
rebecca-ritz,rebecca-ritz,Rebecca Ritz,,actor,,Rebecca Ritz as Evelyn Miller Next up in Waterboy Second Down cast lineup we have the talented actress and producer Rebecca Ritz.,,scraped,reelshort_fandom_cast
nick-lewan,nick-lewan,Nick Lewan,,actor,,,,scraped,reelshort_fandom_cast
skylan-kimbrell,skylan-kimbrell,Skylan Kimbrell,,actor,,Skylan Kimbrell Talented actress Skylan Kimbrell plays London Jacobson in The Hockey Captain That Hates Me movie.,,scraped,reelshort_fandom_cast
craig-elliott,craig-elliott,Craig Elliott,,actor,,Craig Elliott Actor and stunt performer Craig Elliott plays the strict Northridge Academy principal Harris.,,scraped,reelshort_fandom_cast
claudia-hawkins,claudia-hawkins,Claudia Hawkins,,actor,,"Firstly, let’s introduce you to Claudia Hawkins, an Atlanta star and a rising actress.",,scraped,reelshort_fandom_cast
janine-czajka,janine-czajka,Janine Czajka,,actor,,"Janine Czajka as Claudia Talented actress Janine Czajka, who previously stole the show in “Cyberking Reclaims His Throne” and “End of the World, Start of My Empire,” is back on ReelShort.",,scraped,reelshort_fandom_cast
